{
 "schema": 1,
 "note": "The shared score of the three music sketches (audio/synth/music_sketch.gd): one 30-second arc and one tune, so the sketches differ only in sound. 96 BPM, 12 bars of 2.5 s. Intensity per bar: 0 overture, 1 the tune, 2 a region breaks and the edge joins, 3 the peak; bar 6 is the chapter drop-out, bar 11 the KO hit. Tune notes are [bar, beat, MIDI note, length in beats]: rising fourths that end open (the Protagonist's promise). dynamics_db is the level of each bar in dB before the final limiter, so the arc builds (the layers alone do not raise the level enough).",
 "bpm": 96,
 "bars": 12,
 "chords": [
  [
   "D",
   "m"
  ],
  [
   "D",
   "m"
  ],
  [
   "Bb",
   "M"
  ],
  [
   "C",
   "M"
  ],
  [
   "D",
   "m"
  ],
  [
   "Bb",
   "M"
  ],
  [
   "D",
   "m"
  ],
  [
   "G",
   "m"
  ],
  [
   "A",
   "M"
  ],
  [
   "D",
   "m"
  ],
  [
   "Bb",
   "M"
  ],
  [
   "D",
   "m"
  ]
 ],
 "intensity": [
  0,
  0,
  1,
  1,
  2,
  2,
  0,
  3,
  3,
  3,
  3,
  0
 ],
 "tune": [
  [
   2,
   0,
   62,
   1.5
  ],
  [
   2,
   1.5,
   67,
   1.0
  ],
  [
   2,
   2.5,
   72,
   1.5
  ],
  [
   3,
   0,
   67,
   1
  ],
  [
   3,
   1,
   72,
   1
  ],
  [
   3,
   2,
   74,
   2
  ],
  [
   4,
   0,
   62,
   1.5
  ],
  [
   4,
   1.5,
   67,
   1
  ],
  [
   4,
   2.5,
   72,
   1.5
  ],
  [
   5,
   0,
   65,
   1
  ],
  [
   5,
   1,
   70,
   1
  ],
  [
   5,
   2,
   74,
   2
  ],
  [
   7,
   0,
   67,
   1
  ],
  [
   7,
   1,
   72,
   1
  ],
  [
   7,
   2,
   77,
   2
  ],
  [
   8,
   0,
   69,
   1
  ],
  [
   8,
   1,
   74,
   1
  ],
  [
   8,
   2,
   79,
   2
  ],
  [
   9,
   0,
   74,
   1
  ],
  [
   9,
   1,
   72,
   1
  ],
  [
   9,
   2,
   69,
   2
  ],
  [
   10,
   0,
   70,
   1
  ],
  [
   10,
   1,
   74,
   1
  ],
  [
   10,
   2,
   77,
   2
  ],
  [
   11,
   0,
   74,
   4
  ]
 ],
 "dynamics_db": [
  -3,
  -3,
  -6,
  -6,
  -3,
  -3,
  -6,
  0,
  0,
  0,
  1.5,
  0
 ]
}
